,name,link,islands,likes/polarity,bio,size,beds,level_available,first_discovered,inventory,time_limit
278,Reebro,https://mysingingmonsters.fandom.com/wiki/Reebro,Air&Colossingum&Ethereal&Mech&,Air Island:Cybop&Ethereal Island:Nebulob&Mech Islet:Nebulob&Mech Islet:Nitebear&Mech Islet:Teeter-Tauter&Mech Islet:Yooreek&Air Island:Barbloo Statue&Ethereal Island:Barbloo Statue&Air Island:Bottomless Pit&Ethereal Island:Bottomless Pit&Air Island:Fuzzle Tree&Ethereal Island:Fuzzle Tree&,"Of all the creatures known in the multiverse, the Reebro is right up there with the strangest. Little more than an oversized brain to begin with, this Ethereal beast develops a mechanical body using its instinctual technological know-how. The Reebro, or simply 'Bro' as it is affectionately called by its fellow Monsters, is a laid-back character who lives for fun and has the scoop on all the latest trends. It's always willing to assist others with their 'Mech'-nical difficulties - even if its go-to solution is to 'turn it off and then turn it on again.'",2,5,9,The Handler-Helper Community,,0
279,Jeeode,https://mysingingmonsters.fandom.com/wiki/Jeeode,Water&Colossingum&Ethereal&Crystal Islet&,Water Island:Tweedle&Ethereal Island:Boodoo&All:Reflecting Pool&All:Digger&All:Tub Fountain&,"The wise Jeeode is renowned for its ability to see all sides of a situation. Harnessing the Ethereal power of Crystal, it pictures each scenario as sitting in the center of a giant prism, looking at each facet one at a time. Then, it somehow creates a solution that leaves everyone smiling. Because of this refined perspective, Jeeodes are first-rate instrumentalists, never missing a note.",2,5,9,The Handler-Helper Community,,0
280,Humbug,https://mysingingmonsters.fandom.com/wiki/Humbug,Earth&Colossingum&Ethereal&Poison Islet&,Earth Island:Thumpies&Ethereal Island:Kazilleon&All:Floofy Nest&All:Flappy Flag&All:Piney Tree&,"The Humbug is the incarnation of the misunderstood Ethereal element of Poison. When it buzzes its wings fast enough, it can open up and glide on supersonic dimensional highways from universe to universe. Humbugs naturally enjoy warm weather, and are drawn to humid places where the hum produced by their wings has the finest tone.",2,5,9,readersam,,0
281,Epic Whisp,https://mysingingmonsters.fandom.com/wiki/Epic_Whisp,Ethereal&Plasma&Shadow Islet&,All:Jellbilly&All:Sweetstreamz Tree&All:Stritch Skin&All:Ockulo Tree&,"The Epic Whisp straddles the line between macabre and lovely, morose and bewitching - no doubt due to its dual parentage of Plasma and Shadow. It harbors a secret that very few in the Monster World know about, and will only reveal it to those who have been completely hypnotized by its 'potion eyes'. The Epic Ethereal tends to behave like a wallflower at social gatherings, but when the party's over, it's been known to participate in playful impishness. But the Epic Whisp is not a bad guy; when given the chance to lead, you should see it in a crown.",2,10,9,JohnVic,,0
282,Epic Nebulob,https://mysingingmonsters.fandom.com/wiki/Epic_Nebulob,Ethereal&Plasma&Mech&,All:Bellowfish&All:Freed Thing&All:Harmonorb Holder&All:Englobulated F.U.M.&,"Epic Nebulob is the answer to a dangerous question: ""Just how much is too much?"" Containing an essence volume equivalent to seventy times seventy Commons, this Epic Ethereal's exo-suit is a miracle of 'Mech-nical' engineering. Even one tiny imperfection could lead to an explosive result rivalling the legendary Big Clangor! Thankfully, its impressive craftsMonship and sedentary lifestyle keep this possibility to a minimum... but never say never.",2,10,9,DimlitBeverage,,0
283,Epic Sox,https://mysingingmonsters.fandom.com/wiki/Epic_Sox,Ethereal&Plasma&Crystal Islet&,All:Dragong&All:Givutawai Tree&All:Castanevine&All:Mount Knottshurr&,"Epic Soxes are reputed to be able to shapeshift into ghost-like apparitions, but this is a misconception - the truth is far more unusual. These vulpine Epic Ethereals actually straddle parallel realities, and have multiple traits to reflect this: they possess two tails, one from each continuity; the horned outgrowth that covers their heads and arms never occurs symmetrically; and their coloration calls forth imagery of suspicious spirits. In one of Epic Soxes' timelines, there's a thriving tourism industry in the Monster World (for some reason), and the 'soup of the day' is the most popular subject for small talk. The Monsters won't provide any further context for these cryptic clues, but they often perform soulful ditties that guess at what might have been, if that reality had ever merged with the main one.",2,10,9,AimeePlaysMSM,,0
284,Epic Jellbilly,https://mysingingmonsters.fandom.com/wiki/Epic_Jellbilly,Ethereal&Plasma&Poison Islet&,All:Mi&All:Optiglowbe&All:Swurlee Tree&All:Jarhead&,"Even though very little of them have been explored, there are in fact substantial bodies of water in the pocket dimension, and that's where the Epic Jellbilly resides. Its straight and pointed orthocone shell is distinct from the soft gelatinous bodies of other subspecies of Jellbilly family. In a classic case of rarity oneupMonship, the Epic Ethereal has 3 eyes instead of 1 or 2... but they are all in the physiological position where the brain should be, so this Monster is understood to actually be more primitive than the others. Some have disputed that this Monster is misclassified and only has a superficial resemblance to other Jellbillies is coincidental [sic], but calling out the presence of sensorial stachacles quickly refutes such claims.",2,10,9,Versace <3,,0
285,Epic Arackulele,https://mysingingmonsters.fandom.com/wiki/Epic_Arackulele,Ethereal&Shadow Islet&Mech&,All:Fa&All:Wubbox Stockpile&All:Shrini&All:Elmenco Stump&,"Once hatched, Epic Arackuleles are overtaken by a primal instinct to skitter beneath the rocks of Ethereal Island and begin chipping away at the obstacle's Crystalline exterior. The glassy chunks are hewn into a jagged chordophone it will carry all its life, each one unique to the Epic Ethereal that crafted it. Epic Arackulele's acid-green abdomen contains a toxic venom that leeches from its glowing spines, warding off any threats creeping below the rocks. While we cannot confirm exactly why this hybrid of Shadow and Mech gravitates so strongly to the Elements of Poison and Crystal, it can be hypothesized that its Epic nature has led it to investigate all that the Ethereal class has to offer.",2,10,9,SeaweedOat,,0
286,Rare Whisp,https://mysingingmonsters.fandom.com/wiki/Rare_Whisp,Ethereal&Plasma&Shadow Islet&,All:Whisp&Plasma Islet:Rare Yooreek&Plasma Islet:Rare Meebkin&Ethereal Island:Travelers' Sign&Ethereal Island:Toob&Ethereal Island:Reflecting Pool&,"Most Monsters would trade an arm and a leg for a chance to improve their performance skills... the Rare Whisp seems to have done the opposite and grown some! Or maybe all Whisps have limbs tucked under their flowing, dress-like bodies and only the Rares choose to let it all hang out? Either way, these Rarethereals are convinced their elongated bodies give their singing range a boost... but in truth, their Common cousins seem just as talented.",2,10,9,Cyraxgreen #,,0
287,Rare Nebulob,https://mysingingmonsters.fandom.com/wiki/Rare_Nebulob,Ethereal&Plasma&Mech&,All:Nebulob&Plasma Islet:Rare Yooreek&Mech Islet:Rare Yooreek&Plasma Islet:Rare Gaddzooks&Mech Islet:Rare Gaddzooks&Plasma Islet:Rare Auglur&Mech Islet:Rare Auglur&Ethereal Island:Directions to Nowhere&Ethereal Island:Bottomless Pit&Ethereal Island:Tub Fountain&,"A 'Rhythm & Ooze' connoisseur, the purplish essence of the Rare Nebulob wants the fast and loose improvisational style of its preferred genre to be reflected in all aspects of its existence. However, it tends to go a bit overboard, and sprouts as many eyes as will fit in the dome of its exo-suit. It's a good thing this Rarethereal is lighter than air, otherwise it would undoubtedly wobble on its only leg. Still, this Monster's loopy lifestyle isn't hurting anybody, so its fellows on Ethereal Island are happy to let it do its thing.",2,10,9,JayFire,,0
288,Rare Sox,https://mysingingmonsters.fandom.com/wiki/Rare_Sox,Ethereal&Plasma&Crystal Islet&,All:Sox&Plasma Islet:Rare Meebkin&Plasma Islet:Rare Gaddzooks&Ethereal Island:Smunkin Patch&Ethereal Island:Crumpler Tree&Ethereal Island:Yum Yum Tree&,"Because they belong to a naturally - or rather, Ethereally - introverted species, Soxes shy away from spontaneous musical improvisations with fellow Monsters. After all, who knows what embarrassing sound could potentially escape from their tail holes? The Rare variant, however, puts its oversized ears to good use by experimenting with new harmony lines at such a low volume that only it can hear them. This little trick boosts its confidence, but it still needs to psych itself up for full scale performances.",2,10,9,*EkaterinaV*,,0
289,Rare Jellbilly,https://mysingingmonsters.fandom.com/wiki/Rare_Jellbilly,Ethereal&Plasma&Poison Islet&,All:Jellbilly&Plasma Islet:Rare Sox&Plasma Islet:Rare Auglur&Ethereal Island:Bottomless Pit&Ethereal Island:Hollow Log&Ethereal Island:Tub Fountain&,"Imagine the surprise of Cybop admirers everywhere when the Rare Jellbilly first appeared! This Monster's sensorial 'stachacles' grow above two beady eyes, instead of below just one, producing an altogether different vibe. In turn, Cybops scampered to update their own look, but the Rarethereal was quick to dissuade them, insisting that it's best to stay true to oneself. Wise words for Monsters of all Elements and Classes.",2,10,9,Shadow Monkey,,0
290,Rare Arackulele,https://mysingingmonsters.fandom.com/wiki/Rare_Arackulele,Ethereal&Mech&Shadow Islet&,All:Arackulele&All:&Ethereal Island:Toob&Ethereal Island:Directions to Nowhere&Ethereal Island:Dragoon Statue&,"What do you get when the soul of a gastronome goes knap-sacking in an arthropod's body? Why, none other than the Rare Arackulele! Upon discovering that its instrument could double as a whisk, this musical epicurean saw fit to whip up such treats as scrumptious saffron syllabubs - all in about the time it takes to strum along to the Ethereal song! In its spare time, it enjoys crocheting toupees for the hairless neighbors of its island home.",2,10,9,Cyraxgreen #elkaiser,,0
291,Whisp,https://mysingingmonsters.fandom.com/wiki/Whisp,Ethereal&Colossingum&Plasma&Shadow Islet&,Ethereal Island:Reebro&Plasma Islet:Whaill&Plasma Islet:Yooreek&Plasma Islet:Meebkin&Plasma Islet:Lowb&Ethereal Island:Beeyoot Tree&Ethereal Island:Ambered Thing&Ethereal Island:Puffle Tree&,"Even though it may look like the Whisp doesn't get out too often, nothing could be further from the truth. It loves to swoop, glide and careen through the phantasmagorical terrain of Ethereal Island, entertaining other Monsters with its mellifluous voice and charming conversational skills. Whisps don't cast reflections in mirrors, which makes it difficult to preen their stylish hairdos.",2,10,9,The Handler-Helper Community,,0
292,Nebulob,https://mysingingmonsters.fandom.com/wiki/Nebulob,Ethereal&Colossingum&Plasma&Mech&,Ethereal Island:Grumpyre&Plasma Islet:Whaill&Plasma Islet:Yooreek&Mech Islet:Yooreek&Plasma Islet:Gaddzooks&Mech Islet:Gaddzooks&Mech Islet:Vhenshun&Plasma Islet:Lowb&Plasma Islet:Auglur&Mech Islet:Auglur&Ethereal Island:Fossil-osaurus&Ethereal Island:Tree Forte Tower&Ethereal Island:Toob&,"The little-understood Nebulob is one of the few Monsters born without a predisposition to music. Instead, it is something that the Nebulob works on all its life, constantly researching new and exciting genres to learn from and experiment with. The elaborate exo-suit it dons aids in the creation of its own special style, a dulcet mix of machine and spirit. If pressed, the Nebulob will confess its favorite musical genre as 'Rhythm & Ooze.'",2,10,9,The Handler-Helper Community,,0
293,Sox,https://mysingingmonsters.fandom.com/wiki/Sox,Ethereal&Colossingum&Plasma&Crystal Islet&,Ethereal Island:Grumpyre&Plasma Islet:Whaill&Plasma Islet:Meebkin&Plasma Islet:Gaddzooks&Plasma Islet:Lowb&Ethereal Island:Bloofi Tree&Ethereal Island:Cozee Cabin&Ethereal Island:Spurrit Statue&,"According to monster lore, the ancestors of the Sox were self-conscious of the gaping holes in their tails. Over time, it was discovered that eating precious stones spurred the growth of peculiar metal pads over the holes. Quite by accident, Soxes learned they could use them, along with their tube-like snouts, to create smooth musical riffs! The age-old mystery of 'What does the Sox say' has now been solved.",2,10,9,Culbaby13,,0
294,Jellbilly,https://mysingingmonsters.fandom.com/wiki/Jellbilly,Ethereal&Colossingum&Plasma&Poison Islet&,All:Sox&Plasma Islet:Whaill&Plasma Islet:Auglur&Plasma Islet:Flasque&Ethereal Island:Leafy Sea Dragon&Ethereal Island:Flappy Flag&Ethereal Island:Squeed Statue&,"This rootin'-tootin' Ethereal is something of a legend to the scavenging Cybops of the neighboring dimension. Their cycloptic vision and distinctive vocal twang are modeled after the Jellbilly's own. Even though they may never meet face-to-face, Jellbillies generously return every piece of Cybop fan mail they receive, taking advantage of their many tentacles to write several replies at once.",2,10,9,Monstermash,,0
295,Arackulele,https://mysingingmonsters.fandom.com/wiki/Arackulele,Ethereal&Colossingum&Mech&Shadow Islet&,Ethereal Island:Ghazt&Mech Islet:Vhenshun&Mech Islet:Piplash&Mech Islet:Nitebear&Mech Islet:Auglur&Ethereal Island:Harpsitree&Ethereal Island:Zuffle Tree&Ethereal Island:Guitree&,"Multi-limbed and multi-talented, the Ethereal Monster known as the Arackulele experiences no greater joy than when it's plucking and strumming on its homemade chordophone. Its rousing and inspirational musical stylings are emblematic of its whole attitude towards life: even though we are all just specks in the vastness of the multiverse, when enough Monsters join together in harmony, anything is possible!",2,10,9,The Handler-Helper Community,,0
296,Epic Boodoo,https://mysingingmonsters.fandom.com/wiki/Epic_Boodoo,Ethereal&Shadow Islet&Crystal Islet&,All:Fung Pray&All:The Thunker&All:Floofy Nest&All:Bingo Bango Bongos&,"Remember how we said that a Boodoo's uncanny appearance is actually at odds with its gentle disposition? Well, forget all that as far as the Epic Boodoo is concerned - it's every bit as frightening as its exterior would suggest. This Monster is able to gaze at the starscape and be granted visions of deep space horrors, and which in turn lead to mutations of its own attributes. One of the most distressing aspects of this Epic Ethereal is its 'spacesuit' - it's not actually a suit at all, but a form of mimetic camouflage that is meant to disorient and disguise its true form.",2,10,9,StarUp,,0
297,Epic Kazilleon,https://mysingingmonsters.fandom.com/wiki/Epic_Kazilleon,Ethereal&Shadow Islet&Poison Islet&,All:Do&All:Miniature Island Complex&All:Star Rocks&All:Fuzzle Tree&,"Epic Kazilleons can color-shift at many times the speed of their Common cousins, even shifting their scales into color spectrums invisible to the human eye. This ability causes such a powerful buildup of noxious fumes that the Monster simply must release it! Thus, Epic Kazilleon has evolved a multitude of crater-like vents, and forces all color out of its body in chromatic puffs of gas. This leaves the Monster's skin so dull and brittle, it is even known to lose its tail! Worry not, as this species is known for its rapid regeneration.",2,10,9,RamenSharkYT,,0
298,Epic Bellowfish,https://mysingingmonsters.fandom.com/wiki/Epic_Bellowfish,Ethereal&Mech&Crystal Islet&,All:Wubbox&All:PU System&All:Boss Monument&All:Piney Tree&,"Even though it's cracked like that of its Rare counterpart, the crystal of the Epic Bellowfish's suit is chemically pure and stable (with no adulerants [sic] like Monsterling formula or chili powder). However, contrary to the mechanized suit of its Common cousin, the Epic's is actually made of rubber and extends beyond its torso and 'arms' to include its legs as well. The Epic Ethereal asserts that it's to defend against foreign contaminants, like the buzzing dragonflies of the pocket dimension - but the embarrassing truth is that it has a sensitivity to aquaslime and must be shielded at all times. This is an open secret among the other Ethereals, but they pretend not to know to safeguard the Epic Bellowfish's dignity - s'all good, Monster.",2,10,9,Jaymz Cannon,,0
299,Epic Dragong,https://mysingingmonsters.fandom.com/wiki/Epic_Dragong,Ethereal&Mech&Poison Islet&,All:Ti&All:Inverdigus Fern&All:Thumpies Totem&All:Odd-o-Mobile&,"It is a well-established fact that Dragongs use their metallic plates to glide across the surface of bodies of water big and small. For Epic Dragongs, there is simply no greater thrill than turning this leisurely pastime into a full-blown extreme sport! Reinforced plates fitted with outer flotation devices ensure reliable handling and back-up buoyancy, while the Monster's intimidating cranial hood flares out like a sail to manage speed and allow for precise directional control. Finally, the serpentine Epic Ethereal's scale pattern acts as a reflective safety vest, visible even at great distances - one can never take water safety too seriously when you're shredding waves atop the aquaslime canals!",3,10,9,aran,,0
300,Epic Fung Pray,https://mysingingmonsters.fandom.com/wiki/Epic_Fung_Pray,Ethereal&Crystal Islet&Poison Islet&,All:La&All:Cave Crystal Teleporter&All:Spatial Sapling&All:Ockulo Tree&,"Fung Prays are known to seek balance in all things - but should a Fung Pray challenge the status quo and embrace total chaos? Epic Fung Pray is born from this desire for total imbalance. Rest assured that this Epic Ethereal doesn't wish harm or dissonance upon the Monster World, but rather it encourages the acceptance that not everything is within our control, and we cannot predict our own destinies. This liberating notion has freed the Epic Fung Pray's mind and body, resulting in a unique technicolor form that defies explanation or logic. Its four bright eyes can see four different possible outcomes to any situation, but suffer from near-sightedness.",2,10,9,Chainsaw Maw,,0
301,Rare Boodoo,https://mysingingmonsters.fandom.com/wiki/Rare_Boodoo,Ethereal&Shadow Islet&Crystal Islet&,All:Boodoo&All:Pipes of Cicado&All:Eerie Remains&All:Tree Hut&,"Boodoos in general are weird, but the Rares of this species exceptionally so. It's not clear whether the third eye revealed by their tusked masks is unique to these Rarethereals, or secretly shared by all Boodoos. They turn everything they find into so-called 'Boodoo dolls,' which they delight in gifting to their reluctant cohorts. Despite their wild, flailing dance, these Monsters manage to frighten absolutely no one - except each other.",2,10,9,Firebro510-Gettingnewname,,0
302,Rare Kazilleon,https://mysingingmonsters.fandom.com/wiki/Rare_Kazilleon,Ethereal&Shadow Islet&Poison Islet&,All:Kazilleon&All:Squeed Statue&All:Zuffle Tree&All:Fossil-osaurus&,"The winged Rare Kazilleon differs from the Common variety in that the exhaust it emits is inoffensive, non-toxic, and smells rather like Moonjube Upside-Down Cake (with a dollop of Lillypilly Cream). These colorful fumes purportedly soothe fussy babies and can curl a fellow monster's fur or tentacles into luxurious spirals within seconds of exposure. Up for anything, this intrepid Rarethereal has seen and done everything there is to see and 'doo-wop!'",2,10,9,Mara,,0
303,Rare Bellowfish,https://mysingingmonsters.fandom.com/wiki/Rare_Bellowfish,Ethereal&Mech&Crystal Islet&,All:Bellowfish&Mech Islet:Rare Auglur&Mech Islet:Rare Yooreek&Ethereal Island:Razzli Tree&Ethereal Island:Wild Bagpipe&Ethereal Island:Tree Forte Tower&,"Despite its flamboyant red pigmentation, the Rare Bellowfish's mechanized suit is typically powered by an inferior crystal. As such, it is far more subdued than its Common brethren and much less socially inclined... until it is challenged to a dance-off. Putting its three legs to good use, this Ethereal cuts a rug like no one's business, busting a move it calls 'Bellowfishing this up.'",2,10,9,Firebro510-Gettingnewname,,0
304,Rare Dragong,https://mysingingmonsters.fandom.com/wiki/Rare_Dragong,Ethereal&Mech&Poison Islet&,All:Dragong&Mech Islet:Rare Auglur&Mech Islet:Rare Yooreek&Ethereal Island:Fire Bush&Ethereal Island:Castanevine&Ethereal Island:Eerie Remains&,"Very few have actually witnessed it, but it's said that the Rare Dragong has limited flight capabilities! The coloration of its plates is actually owing to the fact that they are hot to the touch. Then, it simply heats the air below it, and surfs around on the updraft. Finally, the rest of its body maintains a frigid temperature to avoid overheating. The ingenuity of Rarethereals never ceases to amaze.",3,10,9,alex_swimming19,,0
305,Rare Fung Pray,https://mysingingmonsters.fandom.com/wiki/Rare_Fung_Pray,Ethereal&Crystal Islet&Poison Islet&,All:Fung Pray&All:Smunkin Patch&All:Hollow Log&All:Pipes of Cicado&,"Rares of this species have embraced balance so much so that their headcaps shrivel away to reveal plant-like growth climbing skyward. This growth eventually extends all over their bodies, even prompting extra stridulatory limbs to sprout! They believe this represents an unfettering of the imagination, and a powerful connection to the Natural world - even though they're Ethereal!",2,10,9,Mamy,,0
306,Boodoo,https://mysingingmonsters.fandom.com/wiki/Boodoo,Ethereal&Colossingum&Shadow Islet&Crystal Islet&,All:Jeeode&All:Stritch Skin&All:Castanevine&All:Fossil-osaurus&,"Offspring of Shadow and Crystal, Boodoos are contradictory creatures. Its uncanny appearance belies a gentle soul who enjoys home-cooking, collecting vintage dolls and artisanal craft-making. A Boodoo's shakers and ornamental headdress represent only a small portion of its creative pursuits; Monsters far and wide will travel to witness the unveiling of a Boodoo original.",2,10,9,The Handler-Helper Community,,0
307,Kazilleon,https://mysingingmonsters.fandom.com/wiki/Kazilleon,Ethereal&Colossingum&Shadow Islet&Poison Islet&,All:Humbug&All:Yum Yum Tree&All:Leafy Sea Dragon&All:Eerie Remains&,"Kazilleons aren't the greatest-smelling Monsters. For one, the toxic gas they spew when they're singing has been known to singe fur and upset appetites. To boot, the noxious fumes emanating from their color-shifting skin is sometimes harvested to help strip paint off of old buildings. The thing is, they're so friendly, everyone wants them around anyhow.",2,10,9,DianeDelsig,,0
308,Bellowfish,https://mysingingmonsters.fandom.com/wiki/Bellowfish,Ethereal&Colossingum&Mech&Crystal Islet&,Ethereal Island:Ghazt&Mech Islet:Auglur&Mech Islet:Teeter-Tauter&Mech Islet:Piplash&Mech Islet:Yooreek&Ethereal Island:Meldablend&Ethereal Island:Tree Hut&Ethereal Island:Zuffle Tree&,"Indigenous to the aquaslime pools of Ethereal Island, this blubberous beast always wants to be smack dab in the middle of the action. So that they never miss out on that action, Bellowfish cooperate to create each other's crystal-powered mechanized suits, which let them leave the water and join in the musical menagerie. That said, they're not particularly known for their punctuality; if there's a latecomer to a Monster party, it's safe to assume a Bellowfish is the one who knocks.",2,10,9,Pyrofighter40,,0
309,Dragong,https://mysingingmonsters.fandom.com/wiki/Dragong,Ethereal&Colossingum&Mech&Poison Islet&,Ethereal Island:Jeeode&Mech Islet:Vhenshun&Mech Islet:Piplash&Mech Islet:Auglur&Mech Islet:Yooreek&Ethereal Island:Dragon Tower&Ethereal Island:Beeyoot Tree&Ethereal Island:Dragoon Statue&,"The Dragong's lithe body belies incredible strength and resilience, which it uses to absorb the vibration of its tail- and feet-plates. In addition to the cymbal-like clashing they create, these plates allow the Dragong to skim the water's surface, and unsurprisingly, to prepare delicious dishes for its Ethereal cohorts.",3,10,9,cookster77,,0
310,Fung Pray,https://mysingingmonsters.fandom.com/wiki/Fung_Pray,Ethereal&Colossingum&Crystal Islet&Poison Islet&,All:Bellowfish&All:Bottomless Pit&All:Directions to Nowhere&All:Cozee Cabin&,"The chimeric Fung Pray strives to achieve complete balance in all aspects of life, according to transcendental teachings passed down from generation to generation. Even though tranquility and precision are held in highest esteem, the occasional burst of unbridled exuberance is permitted. Bystanders can identify such a display by the appearance of glowing gills under the Fung Pray’s headcap.",2,10,9,rjc123,,0
311,Rare Yooreek,https://mysingingmonsters.fandom.com/wiki/Rare_Yooreek,Workshop&Plasma&Mech&Shadow Islet&,All:Yooreek&Plasma Islet:Rare Gaddzooks&Mech Islet:Rare Gaddzooks&Plasma Islet:Rare Ghazt&All:&Mech Islet:Rare Reebro&All:&Ethereal Workshop:Fuzzle Tree&Ethereal Workshop:Travelers' Sign&Ethereal Workshop:Odd-o-Mobile&,"Rare Yooreek's steadfastness and support of its friends can come off as a little single-minded at times, which can be troublesome as no one is sure where its mind is located yet. One sometimes has to wonder if Rare Yooreek is all there. Attached at the hip to its good buddy Rare Gaddzooks, this Rarethereal sure likes to go with the flow. But is that so bad? Like the old saying goes, a Mon in the hand is worth two in the Fire Bush. Whether its contrasting colors were the result of a genetic side effect or a part of its friends' elaborate schemes, Rare Yooreek is just happy to be matching.",2,15,19,Lorelai uwu,,0
