,name,link,islands,likes/polarity,bio,size,beds,level_available,first_discovered,release_year,inventory,time_limit,breeding_combos
84,Rare Entbrat,https://mysingingmonsters.fandom.com/wiki/Rare_Entbrat,Plant&Gold&,All:Entbrat&All:Castanevine&All:Dragon Tower&All:Meldablend&,"As if Entbrats weren't impressive enough already! The Rare Entbrat sports vibrant autumnal foliage and eye-catching horn extensions. Reports suggest that this uncommon morph is at least marginally smarter than its regular counterpart, but don't hold your breath waiting for it to score well on any intelligence test.",3,4,9,NE LAiKAT,2014,,0,
85,Shellbeat,https://mysingingmonsters.fandom.com/wiki/Shellbeat,Water&Colossingum&Gold&Tribal&Composer&,All:Noggin&All:Yum Yum Tree&All:Puffle Tree&All:Dragon Tower&,"Shellbeats are naturally shy and like to keep hidden away in their shells. When they are woken up by their neighbors' loud singing they tend to loosen up, come out of their shell, and play along as best they can with their aquatic drum set. Shellbeats have gotten pretty good at playing lately.",3,4,9,The Handler-Helper Community,2012,,0,
86,Quarrister,https://mysingingmonsters.fandom.com/wiki/Quarrister,Earth&Colossingum&Gold&Tribal&Composer&,All:Mammott&All:Tree Hut&All:Bass String Bridge&All:Zuffle Tree&,"The first stage of the Quarrister's life cycle begins deep underground. Each head is a separate creature, feeding on crystals and fending for themselves. Eventually, groups of heads band together and harmonize their efforts until they physically fuse together. Every once in a while, one of the Quarrister's voices will go for a solo, but that kind of behavior is usually seen as big-headed.",3,4,9,The Handler-Helper Community,2012,,0,
87,Deedge,https://mysingingmonsters.fandom.com/wiki/Deedge,Cold&Shugabush&Colossingum&Gold&Tribal&Composer&,Shugabush Island:Shugabuzz&All:Leafy Sea Dragon&All:Zuffle Tree&All:Piney Tree&All:Squeed Statue&,"The Deedge, attuned to the beat of the Earth, pulls together multiple elements to produce a complex beat. A tireless, energetic performer, it keeps all the Monsters dancing.",3,4,9,The Handler-Helper Community,2012,,0,
88,Riff,https://mysingingmonsters.fandom.com/wiki/Riff,Air&Colossingum&Gold&Tribal&Composer&,All:Toe Jammer&All:Bass String Bridge&All:Leafy Sea Dragon&All:Crumpler Tree&,"Riffs are masterful musicians. Very little is known about these complex Monsters, but they do have some distinct and unusual habits. For example, Riffs use their flexible toes to select random objects from the ground which they inspect, then eat.",3,4,7,The Handler-Helper Community,2012,,0,
89,Entbrat,https://mysingingmonsters.fandom.com/wiki/Entbrat,Plant&Colossingum&Gold&Tribal&Composer&,All:Mammott&All:Flappy Flag&All:Guitree&All:Babayag Tower&,The complex combination of elements that produces an Entbrat results in a truly gentle giant. This massive Monster's great bellow vibrates the particles of the world from the clouds in the sky to the stones in the ground. Entbrats are not notably intelligent.,3,4,9,The Handler-Helper Community,2012,,0,
90,Epic Mimic,https://mysingingmonsters.fandom.com/wiki/Epic_Mimic,Oasis&,All:Fa&All:Wubbox Stockpile&All:Crumpler Tree&All:Inverdigus Fern&,"Pre-cataclysmic murals depict a guiding spirit, taking shape in the billowing clouds of an ancient mountain range. Alpine peaks stood as guideposts for migrating Monsters amidst dense mist and fog, and a cawing laugh would reverberate through the slopes to help orient travellers to safe passage. If one attempted to approach the source of the laugh, a 'luminous substance' would briefly flash, and then lighten to nothingness. Much later, this was determined to be none other than the Epic Mimic, using its evolutionary adaptations to protect itself and preserve a 'shroud of mystery.' Of course, the mocking mass of beak, talon and ocular oddity is by no means rarified Air; it is quite dense, and a bit of a goofball. Whatever inspired the Epic Air Top Boss to reveal itself and join its fellow Monsters in song, we may never know, but its mimicking affectations never fail to bring a smile, carried on the wind like voices bouncing off the walls of a mountain pass.",2,5,9,SugarLilyCat,2026,,0,All:Wynq*Glowl&
91,Rare Mimic,https://mysingingmonsters.fandom.com/wiki/Rare_Mimic,Oasis&,All:Mimic&All:Eerie Remains&All:Freed Thing&All:Shrini&,"Previously believed to have gone extinct, the Rare Mimic has made a miraculous return to the modern Monster World! Or has it? It's perplexing at best to attempt to classify the Air Quint's subspecies and variant forms, because of the Monster's ability to shapeshift to impersonate (imMonsterate?) others. Adding to the bafflement are recently-published scientific studies that purport that certain Monsters that have long been understood to be distinct species are actually just Mimics in disguise? Or maybe they decided to settle into a new form (and Class!) and stay that way forever? Even that part of the theory is convoluted. Rare Mimics are, at minimum, still identifiable as Mimics, even if some attributes have been tweaked.",2,5,9,,2025,,0,
92,Mimic,https://mysingingmonsters.fandom.com/wiki/Mimic,Oasis&,All:Gobbleygourd&All:Smunkit&All:Spurrit Statue&All:Mountain Morsel&,"Mimic?! What are you doing here? We now have substantial evidence that the shapeshifting Air Top Boss has been laying low in the Monster World ever since the Dawn of Fire, masquerading as its fellow Monsters. Previously, these imitations have extended only to appearance and sound, but now it seems like the Mimic is upping the ante and trying to pass itself off as a Relic-seeking Fire Monster. Those in the know are wise to its chicanery, but the rabble has been successfully duped - the trick has something to do with the mysterious atmosphere the Mimic can generate around itself, and the way light bends around it. That voice, though… there’s no mistaking that voice.",2,5,9,The Handler-Helper Community,2024,,0,
