,name,link,islands,likes/polarity,bio,size,beds,level_available,first_discovered,inventory,time_limit
371,Rare Whajje,https://mysingingmonsters.fandom.com/wiki/Rare_Whajje,Wublin&,Rare Zynth&Rare Dwumrohl&,"Inspired by frequent contact with a certain bubble-blowing Seasonal, the Rare one of this Wublin has been reimagined in that Monster's partial likeness. Lagomorph ears and a white and purple striped torso evoke the pre-eminent detective who was instrumental in revealing Electricity's landmark island in the first place - Whajje think about that?",2,0,13,coffee lover,Rare Tweedle:3&Rare Deedge:3&Rare Dandidoo:4&Rare Cybop:4&Rare Reedling:4&,0
372,Rare Creepuscule,https://mysingingmonsters.fandom.com/wiki/Rare_Creepuscule,Wublin&,Rare Gheegur&Rare Whajje&,"Rare Creepuscule ups the wig game of its Common counterpart, flaunting a red yarn hairpiece that complements its green scaly skin. From a distance, one might say that this Rare Wublin resembles a juicy tropical fruit - only upon closer examination do its rows of teeth and ossified drum negate the prior observation.",3,0,13,WILL,Rare Noggin:4&Rare Deedge:2&Rare Shellbeat:2&Rare Pummel:3&Rare Quibble:4&Rare Congle:3&Rare T-Rox:3&,0
373,Rare Blipsqueak,https://mysingingmonsters.fandom.com/wiki/Rare_Blipsqueak,Wublin&,Rare Tympa&Rare Screemu&,"While the Common Blipsqueak presents a balanced offering of organic eyes and toes, and robotic ears and nose, its gold-plated Rare variant leans completely into the world of mechanical automata. While those eyes may look biological, they are in fact fully synthetic, complementing its suite of retrofuturistic body parts from the kingdom of Mait-Land's illustrious history.",2,0,13,MonsterKeeperN8,Rare Toe Jammer:2&Rare Deedge:2&Rare PomPom:2&Rare Cybop:3&Rare T-Rox:3&,0
374,Rare Scargo,https://mysingingmonsters.fandom.com/wiki/Rare_Scargo,Wublin&,Rare Maulch&Rare Blipsqueak&,"Around the gift-giving time of year, the Rare Scargo really comes into its own, and piles its creativity into fashioning imaginative toys and trinkets for its fellow Wublins. Its crowning achievements is the great big electro-Mon-cardio-snooks, an elaborate musical contraption that can be operated by several Monsters at once; but even at full strength, it can't compete with the decibel levels attainable by the Rare Scargo alone… oh, the noise, noise, noise, noise!",3,0,13,JTS,Rare Shellbeat:1&Rare Clamble:1&Rare Dandidoo:1&Rare Shrubb:1&Rare Pummel:1&Rare Spunge:1&,0
375,Rare Astropod,https://mysingingmonsters.fandom.com/wiki/Rare_Astropod,Wublin&,Rare Brump&Rare Bona-Petite&,"Over time, routine exposure to the heavenly sights and sounds of Gold Island's higher plane have seeped into the Wubbox's design sensibilities... made abundantly apparent in the Rare Astropod! Its jade green tones of its skin and shell evoke the shimmering surfaces of the Crystal Castle, and auric highlights call to mind the lustre of Gold Island's metallic ornamentation.",2,0,13,Prajeck EX,Rare Deedge:2&Rare Scups:3&Rare Shellbeat:2&Rare Toe Jammer:4&Rare Reedling:3&Rare Spunge:3&,0
376,Whajje,https://mysingingmonsters.fandom.com/wiki/Whajje,Wublin&,Zynth&Dwumrohl&,"For a Wublin, the Whajje is almost... dainty. Named for its distinctive 'Whajje-Whajje' cry, it can most often be found standing on tippy-toes so that its song rings out above the heads of other Monsters. Whajjes scrupulously preen their feathers to create a sort of dish to amplify the sound of their voices. Other Supernaturals are always daring it to join their capers, but the Whajje is better-behaved than most - a trait for which it cryptically credits its furry feet.",2,0,13,Maude,Tweedle:6&Deedge:7&Dandidoo:10&Cybop:10&Reedling:10&,10
377,Creepuscule,https://mysingingmonsters.fandom.com/wiki/Creepuscule,Wublin&,Gheegur&Whajje&,"In the gloomy twilight of Wublin Island, the eerie gleam of the Creepuscule's plate can make it even harder to tell what time of day it is. This Monster takes full advantage of its unique physiology to showcase true percussive prowess. The nails that tip its long, finger-like limbs are actually tightly packed strands that are more like stiff hairs. The 'hair' on its head is probably a wig, but hey, right on - whatever makes a Creepuscule feel good, right?",3,0,13,onion...,Noggin:12&Deedge:5&Shellbeat:5&Pummel:6&Quibble:10&Congle:8&T-Rox:6&,7
378,Blipsqueak,https://mysingingmonsters.fandom.com/wiki/Blipsqueak,Wublin&,Tympa&Screemu&,"Before settling into its finalized form, this impassioned Wublin decided that its musical contribution would be to recite several words it had heard on faint radio frequencies from the human universe, in a kingdom known only as the Mait-Land. Its maker acquiesced to these linguistic leanings, making sure to fashion a robotic body that featured all the parts mentioned - well, in one form or another, or rather in a way that only a Monster could truly do.",2,0,13,Avik123480,Toe Jammer:4&Deedge:4&PomPom:4&Cybop:6&T-Rox:6&,5
379,Scargo,https://mysingingmonsters.fandom.com/wiki/Scargo,Wublin&,Maulch&Blipsqueak&,"Nobody is sure whether the constant collision of the Scargo's clash cymbal-tipped eye-stalks causes it any discomfort, or if the Wublin has just gotten used to it. What is sure is that this Monster's technique is near-perfection - many new percussionists can't seem to get a handle on the proper grip. Then again, if the cymbals were attached to you, you might figure it out quicker than most, too.",3,0,13,Joe Kennedy,Shellbeat:3&Clamble:3&Dandidoo:3&Shrubb:3&Pummel:2&Spunge:2&,3
380,Astropod,https://mysingingmonsters.fandom.com/wiki/Astropod,Wublin&,Brump&Bona-Petite&,"The Astropod is a bizarre amalgam of seemingly incompatible features that come together to create a truly unique Monster performer. The electricity that courses through its Wublin body manifests itself between its antlers and in the color-shifting tufts on its shell. Conversing with an Astropod is a complicated affair, as the slightest movement of its puny upper arms communicates nuanced subtexts and exposed veiled thoughts.",2,0,13,MonsterTamer,Deedge:5&Scups:8&Shellbeat:5&Toe Jammer:10&Reedling:8&Spunge:6&,10
381,Rare Pixolotl,https://mysingingmonsters.fandom.com/wiki/Rare_Pixolotl,Wublin&,Rare Whajje&Rare Scargo&,"Rare Pixolotl bears a strong affinity for the Mech Element, syncing up with the month of its inaugural evolution. This neck-bearded newt loves immersing itself in the digital world, playing its favourite video games late into the night. Its console of choice is the Eksboks Series Eks, which it has tastefully customized with RGB light displays mimicking its own bioluminescence.",2,0,13,Anxelz :),Rare Entbrat:3&Rare Riff:3&Rare Scups:4&Rare Pummel:3&Rare T-Rox:3&Rare Cybop:4&Rare Fwog:4&,0
382,Rare Bona-Petite,https://mysingingmonsters.fandom.com/wiki/Rare_Bona-Petite,Wublin&,Rare Creepuscule&Rare Zuuker&,"'Family' can be a little overwhelming at the best of times, but the duo of Bona and Petite never even get a chance at personal space! The same is true of their fluorescently colored Rare counterparts, who appear gaunt and underfed even after gorging themselves and haranguing each other at every harvest banquet... but they're wise enough never to take each other for granted, and to settle their snits promptly.",3,0,13,JTS,Rare Mammott:4&Rare Fwog:4&Rare Drumpler:4&Rare Maw:4&Rare PomPom:3&Rare Bowgart:3&Rare T-Rox:3&Rare Riff:2&Rare Entbrat:2&,0
383,Rare Maulch,https://mysingingmonsters.fandom.com/wiki/Rare_Maulch,Wublin&,Rare Poewk&Rare Thwok&,"For being little more than a hummock of soil, the Maulch sure is packed with personality. This inner vibrancy has a chance to manifest in an outer way when the transition into a Rare Maulch is complete, overlaying this 'late bloomer' with greenery and vivacity. The Monster is topped with an even more elaborate flower than the Common's, although the strain of keeping it sturdy and upright can lead to carpel tunnel syndrome.",3,0,13,ThatThingInYourNightmares,Rare Spunge:3&Rare Pummel:3&Rare Noggin:3&Rare Entbrat:2&Rare Quarrister:2&Rare Clamble:2&Rare Furcorn:3&,0
384,Rare Fleechwurm,https://mysingingmonsters.fandom.com/wiki/Rare_Fleechwurm,Wublin&,Rare Dwumrohl&Rare Pixolotl&,"Even though the moon is seldom visible through the lightning of the perpetual storm, the red and gold Rare Fleechwurm has a preternatural instinct for knowing when it's in its new lunar phase. Especially at the beginning of the lunisolar year, it will wriggle its way over to its fellow Wublins, imitating the movements of the fantastical Lion creature of legend, and 'pluck the greens' to bring good fortune - this consists of pinching or squeezing any body part that is liable to produce a tickling sensation!",3,0,13,Epic Clamble Is Epic,Rare Dandidoo:2&Rare Spunge:1&Rare Pummel:2&Rare Shellbeat:1&Rare Furcorn:2&Rare Quarrister:1&Rare Reedling:1&,0
385,Pixolotl,https://mysingingmonsters.fandom.com/wiki/Pixolotl,Wublin&,Whajje&Scargo&,"The Pixolotl is a Supernatural born rascal, through and through. Its gymnastic ability and insatiable appetite for computer chips (and dip) can cause mayhem: the Monster has been observed using its tail as a paddle, climbing ice floes, getting trapped in plumbing, and more. Some Wublins believed if the Pixolotl only had a Castle to roam around in, it would settle down... but alas, no such Castle exists on Wublin Island.",2,0,13,whateverGFJ,Entbrat:6&Riff:6&Scups:10&Pummel:8&T-Rox:8&Cybop:14&Fwog:10&,14
386,Bona-Petite,https://mysingingmonsters.fandom.com/wiki/Bona-Petite,Wublin&,Creepuscule&Zuuker&,"Some musicians tickle the ivories, but the Bona-Petite prefers tickling the ribs. Or perhaps 'having its ribs tickled' is more accurate, depending on which of these two percussionists we're talking about here. Truth is, each is symbiotically connected to the other and equally responsible for delivering punchy kick patterns peppered with a little bottom-end bulk. The duo consists of two Monsters, amiably dubbed 'Bona' and 'Petite' by their Wublin pals. The smaller Petite puts the 'riff' in 'midriff,' while the larger Bona grumbles endlessly about indigestion.",3,0,13,Maria Seymour,Mammott:10&Fwog:10&Drumpler:10&Maw:10&PomPom:6&Bowgart:6&T-Rox:6&Riff:5&Entbrat:5&,10
387,Maulch,https://mysingingmonsters.fandom.com/wiki/Maulch,Wublin&,Poewk&Thwok&,"Sometimes referred to as a 'Clodyawper,' the Maulch is a mound of potting soil with a pronounced underbite. Its vocalizations suggest it gargles with ballast and sandpaper for fun. Its berries - should one be so foolish as to sample them - taste like cinnamon mayonnaise mixed with ham cola and profound regret. The leaf-like appendage atop its noggin acts as a handy parasol, protecting it from inclement weather and some of the more peculiar atmospheric emissions endemic to Wublin Island. It's easily startled by hiccups and denim hats.",3,0,13,Cloudy28,Spunge:6&Pummel:6&Noggin:6&Entbrat:4&Quarrister:4&Clamble:4&Furcorn:8&,7
388,Fleechwurm,https://mysingingmonsters.fandom.com/wiki/Fleechwurm,Wublin&,Dwumrohl&Pixolotl&,"In addition to using them to play music, some Monsters take advantage of their unique features and body shapes, and use them for other purposes. In the case of the Fleechwurm, its resonant body cavity can generate a series of whistles that have an unusual hypnotic effect on other Wublins. They can be used to coax others into doing unglamorous chores for it, or to lovingly preen its leaf-like limbs. Some Wublins are more resistant than others, and playfully admonish the Fleechwurm so it doesn't become too mischievous.",3,0,13,annahhyeah,Dandidoo:4&Spunge:3&Pummel:4&Shellbeat:3&Furcorn:4&Quarrister:3&Reedling:3&,5
389,Shugabush,https://mysingingmonsters.fandom.com/wiki/Shugabush,Plant&Shugabush&Gold&,All:Furcorn&Plant Island:Babayag Tower&All:Tree Hut&All:Bottomless Pit&Shugabush Island:Razzli Tree&,"Despite originating from a warm climate, the kindly Shugabush is unusually furry. Its penchant for sweet treats is legendary, second only to its skill as a performer. The felt hat that adorns its head, which it has been overheard calling a phay-door-uh, is one of its prized possessions, alongside its trusty mandolin, of course. The Shugabush revels in jamming along with other Monsters  and is a true embodiment of the spirit of collaboration.",2,2,9,The Handler-Helper Community,,0
390,Shugabass,https://mysingingmonsters.fandom.com/wiki/Shugabass,Shugabush&,All:Oaktopus&All:Bass String Bridge&All:Hollow Log&All:Shugabuzz&,"This cool customer delivers a mean bass line, but that's the only mean thing about it! The Shugabass is steadfastly supportive of its fellow Monsters and can always be relied on to say a kind word or crack a good joke. The slowest moving member of the Shugafam, the Shugabass' pelt is the perfect environment for a special fungus to thrive which gives it its distinctive teal color.",2,3,9,The Handler-Helper Community,,0
391,Shugitar,https://mysingingmonsters.fandom.com/wiki/Shugitar,Shugabush&,All:Furcorn&All:Dragoon Statue&All:Crumpler Tree&All:Fire Bush&,"To date, no one knows what gives the Shugitar its distinctive ruddy coat. Some have suggested that it came about as a camouflage mechanism to blend in with its guitar... to that theory, others quip, ""When have you ever heard of a guitarist who didn't want to be noticed or recognized?"" Whatever the reason, its musical ability is undisputed.",2,3,9,The Handler-Helper Community,,0
392,Shugajo,https://mysingingmonsters.fandom.com/wiki/Shugajo,Shugabush&,All:Quibble&All:Fuzzle Tree&All:Dragon Tower&All:Pipes of Cicado&,"The perfectionist of the Shugafam, this fastidious fellow values precision and detail above all else. It follows that the Shugajo is the namesake of an instrument that requires a finely-honed technique. The secret to its success? Soothing daily mudbaths, which keep the mind clear and the limbs limber (and tinted a rich, chocolatey brown).",2,3,9,The Handler-Helper Community,,0
393,Shugarock,https://mysingingmonsters.fandom.com/wiki/Shugarock,Shugabush&,All:Shugabeats&All:Beeyoot Tree&All:Guitree&All:Cozee Cabin&,"When it's not strumming away on its electric guitar, the Shugarock enjoys nothing more than to kick back and relax. One of its favorite pastimes is to bask in the warm glow of the midday sun to get a tan. Unfortunately, the sun has little effect on the bark-like skin of the Monster, but it has faded its fur to a pleasant shade of jade. Ever the good sport, the Shugarock has decided to embrace change and keep the color.",2,3,9,The Handler-Helper Community,,0
394,Shugabuzz,https://mysingingmonsters.fandom.com/wiki/Shugabuzz,Shugabush&,All:PomPom&All:Saggle Tree&All:Digger&All:Yum Yum Tree&,"The Shugabuzz is the most eccentric of the Shugafam, mainly reflected in its unusual choice of instrument. Other peculiar traits include its facial fur stylings, and a diet of almost exclusively saggle nuts (which everyone else says taste like rocks and give its limbs their smoky-purple coloration).",2,3,9,The Handler-Helper Community,,0
395,Shugabeats,https://mysingingmonsters.fandom.com/wiki/Shugabeats,Shugabush&,All:Shugitar&All:Harpsitree&All:Ambered Thing&All:Travelers' Sign&,"While it's no stranger to stringed instruments, the Shugabeats has always had a closer affinity to the rhythm selection. An accomplished gardener, it cultivates and sustains a living drumkit made of different types of mushrooms. When struck, the cymbal-shrooms release a fine amber powder, which is why so many Shugabeats' beards are tinted likewise.",2,3,9,The Handler-Helper Community,,0
396,Shugavox,https://mysingingmonsters.fandom.com/wiki/Shugavox,Shugabush&,All:Mammott&All:Floofy Nest&All:Flappy Flag&All:Puffle Tree&,"Even more so than its mandolin-toting cousin, the Shugavox loves to wail out a wild tune in the company of its Monster brethren. It and the Shugabush enjoy a friendly rivalry for pretty much everything, including their tastes in phay-door-uhs. To make itself stand out more, the Shugavox regularly mists itself with essence of Deedge earwax to color itself blue.",2,3,9,The Handler-Helper Community,,0
397,Tawkerr,https://mysingingmonsters.fandom.com/wiki/Tawkerr,Plant&Cold&Earth&,Plant Island:Parlsona&Cold Island:Maggpi&Earth Island:Stoowarb&All:Dragon Tower&All:Ambered Thing&All:Leafy Sea Dragon&,"Unusual among Monsters for its ability to form actual words and sing them in a way that tells a story, it is with wonder and the love of collaboration that the Tawkerr sings its Monster anthem. Constantly dreaming up new compositions, the Tawkerr enjoys supporting friends in times of need. Leaning too heavily upon its shoulders is not recommended, however, lest its shoulder spikes leave unattractive dents in one's fuzzy pelt, satin jacket, or delicate epidermis.",2,1,8,,,0
398,Parlsona,https://mysingingmonsters.fandom.com/wiki/Parlsona,Plant&Air&Water&,Plant Island:Tawkerr&Air Island:Stoowarb&Water Island:Maggpi&All:Floofy Nest&All:Zuffle Tree&All:Bass String Bridge&,"Music is the language of all Monsters, with most expressing themselves instrumentally or through indecipherable - at least to us - vocal sound effects. The Parlsona, however, has been further gifted with the ability to sing in actual words, making it the de facto voice of the Monster World. The Parlsona loves keeping its multicolored talons well filed and it goes through lip balm like no one's business.",2,1,8,,,0
399,Maggpi,https://mysingingmonsters.fandom.com/wiki/Maggpi,Cold&Water&,Cold Island:Tawkerr&Water Island:Parlsona&All:Floofy Nest&All:Tub Fountain&All:Cozee Cabin&,"The Maggpi is nimble of both voice and of mind, with a vocal range spanning the most silvery of sopranos to the most full-bodied of contraltos - and a brain like a steel trap. Although fastidious and well-coiffed, the Maggpi's otherwise silky fur is often matted due to getting hugged so much: such is the burden of one so beloved. Its eyelashes are long and lush and create its own breeze when it blinks.",2,1,8,,,0
400,Stoowarb,https://mysingingmonsters.fandom.com/wiki/Stoowarb,Air&Earth&,Air Island:Parlsona&Earth Island:Tawkerr&All:Freed Thing&All:Star Rocks&All:Spurrit Statue&,"The Stoowarb is a good-natured goofball that uses its glorious gift of gab to bring merriment to Monsters. Impressions, one-liners, wisecracks, and general tomfoolery have earned this jovial jokester a reputation as the life of the party! While many assume the Stoowarb's third eye is imbued with clairvoyant powers, its friends know the truth: it simply serves to distract from this wily Werdo's formidable forehead.",2,1,8,,,0
401,Epic Punkleton,https://mysingingmonsters.fandom.com/wiki/Epic_Punkleton,Plant&Gold&Seasonal&,All:Inverdigus Cemetery&All:Creepy Cauldron&All:Smunk-o-Lantern Patch&All:Frightful Fripperies&,"It may be the most Epic branch in a spidery family tree of scare-masters, but Epic Punkleton just wants to be loved by the masses! This Monster thespian longs to give a performance that elicits a standing ovation from its adoring audience - not screams of terror. It is no stranger to Plant Island's wardrobe department, where it tests out various costume pieces and facial carvings in an effort to appear more relatable to its fellow Monsters.",2,1,9,Brandon H. Earth,,0
402,Epic Yool,https://mysingingmonsters.fandom.com/wiki/Epic_Yool,Cold&Gold&Seasonal&,All:Coldman Colloquy&All:Lamppost&All:Gingerbread Bluff&All:Yaytide Trimmings&,"No matter how it may adorn itself with baubles and bows, Epic Yool always makes a chilling first impression. Thus, the first-known Epic Seasonal prefers a behind-the-scenes role in the Festival of Yay festivities: making lists, checking them thrice, yada yada yada. If Common and Rare Yool are the face of the Yay operation, the busy Epic Yool is the mastermind!",2,1,9,Xander William,,0
403,Epic Schmoochle,https://mysingingmonsters.fandom.com/wiki/Epic_Schmoochle,Air&Gold&Seasonal&,All:Chokkolit Fountain&All:Luff-Balloons&All:Gargle-oyle&All:Curious Cultivar&,"Epic Schmoochle is dripping with sickly-sweet feelings of love and adoration - it's a wonder it doesn't get toothaches! This pair unabashedly indulges in PDA, whispering sweet nothings to one another and stealing quick smooches wherever it goes. Other Monsters may find it a bit nauseating, but nothing can come between these saccharine sweethearts!",2,2,9,IntheM00D,,0
404,Epic Blabbit,https://mysingingmonsters.fandom.com/wiki/Epic_Blabbit,Water&Gold&Seasonal&,All:Ginormous Carrot&All:Rotten Egg&All:Floofy Basket&All:Multiversal Phabberjay&,"For many years, the Epic Blabbit was nothing more than a tall tale whispered conspiratorially between young Monsters. Many claimed to have spotted the blurry silhouette of this horned creature as it dashed across their path, or heard the faraway clip-clop of its hooves while it hopped down its trail. Tired of the gossip and unflattering photography, Epic Blabbit has finally come out of hiding to prove its existence once and for all!",2,1,9,MSMPokeGamer,,0
405,Epic Hoola,https://mysingingmonsters.fandom.com/wiki/Epic_Hoola,Air&Earth&Gold&Seasonal&,All:Beach Chair&All:Granular Castle&All:Hut of a Thousand Perfumes&All:Hot Tub&,"Everyone's raving about this tie-dye raver! Epic Hoola is a world-renowned DJ that hosts the raddest parties this side of the Seam - especially at its usual stomping ground, Club Box. Only the hippest Monsters with an ear to the ground  (or sky!) turn up at Epic Hoola's legendary secret shows. Whether it's your first time at Club Box or your fiftieth, one thing's for sure: any shindig with this Epic Seasonal is bound to be the best. Night. EVER!",2,1,9,Chris (#4),,0
406,Rare Punkleton,https://mysingingmonsters.fandom.com/wiki/Rare_Punkleton,Plant&Gold&Seasonal&,All:Punkleton&All:Stritch Skin&All:Castanevine&All:Reflecting Pool&,"Nobody likes watching someone let themselves go, but this is a regrettable inevitability for the Rare Punkleton. Lacking the hardiness of the Common's Smunkin-like head, it is doomed to decompose faster and turn into a sloppy mess. Donning a paper bag to limit the embarrassment, it's lucky that this ghoulish Rare Seasonal is only really active during a time of dress-up - it fits right in, and no one's the wiser!",2,1,9,kingsmith24,,0
407,Rare Yool,https://mysingingmonsters.fandom.com/wiki/Rare_Yool,Cold&Gold&Seasonal&,All:Yool&All:Harpsitree&All:Flappy Flag&All:Tree Forte Tower&,"Hitching a ride with its Common Seasonal cousin, the Rare Yool journeys to Cold Island each year to ring in the heart-warming Festival of Yay with its fellow Monsters. Legend says it was once a curmudgeonly loner, preferring to spend time by itself - but once it discovered the joy of friendship, it sprinkled its beard with scrumptious candy and resolved to hold the message of goodwill towards all Monsterkind in its heart, no matter the season.",2,1,9,soccer girl 19,,0
408,Rare Schmoochle,https://mysingingmonsters.fandom.com/wiki/Rare_Schmoochle,Air&Gold&Seasonal&,All:Schmoochle&All:Flappy Flag&All:Spurrit Statue&All:Leafy Sea Dragon&,"Love, just like music, is universal. Rare Schmoochles, with their extra set of eyes, claim to be able to see love in all its forms. This enlightenment doesn't mean that the Monster is exempt from conflict - spats and misunderstandings have historically led to literal heartbreak, requiring stitching. In the end, the love you take is equal to the love you make, and the two heads know that they're ultimately destined for one another.",2,2,9,Martin Hammond,,0
409,Rare Blabbit,https://mysingingmonsters.fandom.com/wiki/Rare_Blabbit,Water&Gold&Seasonal&,All:Blabbit&All:Guitree&All:Directions to Nowhere&All:Babayag Tower&,"What do you do when you have the urge to steal - ahem, borrow - Monster eggs and paint them, but your fellow Monsters are wise to your hijinks? Do as the Rare Blabbit does: get organized. It's not unusual for this mustard-colored creature to be the mastermind behind fearless and inventive egg raids. It's also an expert at covering its tracks; its serpentine form leaves none to speak of! The Rare Blabbit's antics take some getting used to, but it assures us we'll soon learn to appreciate it.",2,1,9,Dakota Carter,,0
410,Rare Hoola,https://mysingingmonsters.fandom.com/wiki/Rare_Hoola,Air&Earth&Gold&Seasonal&,All:Hoola&All:Squeed Statue&All:Flappy Flag&All:Leafy Sea Dragon&,"Rare Hoolas are what happen when these mischeivous [sic] Seasonals adhere to the diet of their PomPom cousins! True to form, however, they usually overdo it and become a garish shade of red in the process. This makes it a little more difficult to sneak up on other Monsters or to pull pranks, so the Rare Hoola compensates by adding an extra hoop to distract them using sleight of hand... or in this case, sleight of hoop.",2,1,9,Svetlana,,0
411,Punkleton,https://mysingingmonsters.fandom.com/wiki/Punkleton,Plant&Colossingum&Gold&Seasonal&,Plant Island:Shrubb&Seasonal Shanty:Hoola&All:Tree Forte Tower&All:Smunkin Patch&All:Beeyoot Tree&,"A close relative of Smunkins, the Punkleton lays low for most of the year, with only its head poking above the soil. It is rumored to be the offspring of two Triple-Element Monsters. For a limited time, it will wrench itself out of the ground, and attempt to spook other Monsters with its boisterous song! It apparently works, and easily-startled neighbors would do well to give it a wide berth.",2,1,9,The Handler-Helper Community,,0
412,Yool,https://mysingingmonsters.fandom.com/wiki/Yool,Cold&Colossingum&Gold&Seasonal&,Cold Island:Thumpies&Seasonal Shanty:Blabbit&Cold Island:Deedge&All:Crumpler Tree&Seasonal Shanty:Fuzzle Tree&All:Piney Tree&,"Towards the end of the year, the plump and pleasant Yool schedules a relaxing sojourn on Cold Island. Its arrival is heralded by the jingle bells dangling from its antlers, and the booming resonance of its voice. Just being near a Yool produces feelings of peace and joy, so the other Monsters always try and convince it to stay the whole year round.",2,1,9,The Handler-Helper Community,,0
