,name,link,islands,likes/polarity,bio,size,beds,level_available,first_discovered,inventory,time_limit
0,Epic Tweedle,https://mysingingmonsters.fandom.com/wiki/Epic_Tweedle,Cold&Air&Water&Earth&Gold&Haven&Oasis&,All:Mi&All:Swurlee Tree&All:Spatial Sapling&All:Ockulo Tree&,"Some say that the Epic Tweedle got a little mixed up in the breeding process. Feet for horns (or horns for feet?), a missing beak, too many eyes, plumeless wings - it all comes together to create an unsettling Epic that lacks the feathery charm of its Common cousin. However, once this avian anomaly hits you with its gummy smile, your heart is sure to be won over in an instant.",2,1,4,danielisamaster,,0
1,Epic Potbelly,https://mysingingmonsters.fandom.com/wiki/Epic_Potbelly,Plant&Cold&Water&Earth&Shugabush&Gold&Haven&Light&Psychic&,All:Star Rocks&All:Elmenco Stump&All:Striking Bulbs&All:Castanevine&,"Every Common Potbelly shares a deep connection with the pot it calls home. Epic Potbellies, however, take this protective instinct to new heights!  This territorial Elemental is perfectly pleasant... until an unwitting Monster tries to borrow its pot.  Trespassers cause the Epic Potbelly to transform from delightful daisy to snarling snapdragon, baring its fearsome fangs and flapping its mighty wings. Tragically, the stone reinforcements added to its pot make it much too heavy to fly anywhere.",1,1,9,Master kaydan,,0
2,Epic Noggin,https://mysingingmonsters.fandom.com/wiki/Epic_Noggin,Plant&Air&Water&Earth&Gold&Haven&Faerie&Bone&,Plant Island:Rare Wubbox&Air Island:Rare Wubbox&Water Island:Rare Wubbox&Earth Island:Rare Wubbox&Fire Haven:Kayna&Faerie Island:Kayna&Bone Island:Kayna&All:Givutawai Tree&All:Bingo Bango Bongos&All:Innertuba&,"The lineage of Epic Noggin can be traced to the first Common settlers of Earth Island, the species' Elemental home. While many Noggins migrated to other islands, a select few stayed, preferring the volcanic rumblings and charcoal caverns of Earth Island to any other. Over time, this group's appearance began to mirror its surroundings, transforming into fierce and fiery Epics that now roam free.",2,1,4,reegs2712,,0
3,Epic Toe Jammer,https://mysingingmonsters.fandom.com/wiki/Epic_Toe_Jammer,Plant&Cold&Air&Water&Gold&Oasis&Psychic&Bone&,All:Do&All:Ockulo Tree&All:The Thunker&All:Sweetstreamz Tree&,"Epic Toe Jammers are descendants of a small stubbing of Commons that preferred to dwell in the unexplored sea floor of the living ocean. Slowly these bottomfeeders adapted to the murky depths, growing long claws to anchor themselves to the sand below. The surrounding darkness has made the Epic Toe Jammer less reliant on its vision - Instead, it has grown a crown of anemone to camouflage itself from unwanted guests that lurk out of sight.",2,1,4,Tatta_key 4 KEVIN:))))))),,0
4,Epic Mammott,https://mysingingmonsters.fandom.com/wiki/Epic_Mammott,Plant&Cold&Air&Earth&Shugabush&Gold&Oasis&Light&Faerie&,Plant Island:Wubbox&Cold Island:Wubbox&Air Island:Wubbox&Earth Island:Wubbox&Fire Oasis:Sneyser&Light Island:Gob&Faerie Island:HippityHop&Shugabush Island:Shugabush&All:Smunkit&All:Cold Globe&All:Star Rocks&,"Mammotts may not shovel snow, but Epic Mammotts sure do! This many-limbed Monster has evolved to become the ultimate snow shoveling machine. Four furry arms for maximum snow removal, pointed claws and horns to crack stubborn ice, and floppy ears to protect its delicate eyes from rogue snowballs make Epic Mammott the ideal neighbor.",2,1,4,potawatomi,,0
5,Rare Tweedle,https://mysingingmonsters.fandom.com/wiki/Rare_Tweedle,Cold&Air&Water&Earth&Gold&Haven&Oasis&,All:Tweedle&Cold Island:Potbelly&Water Island:Potbelly&Earth Island:Potbelly&Fire Haven:Potbelly&Air Island:Noggin&Water Island:Noggin&Earth Island:Noggin&Fire Haven:Noggin&Cold Island:Toe Jammer&Air Island:Toe Jammer&Water Island:Toe Jammer&Fire Oasis:Toe Jammer&Cold Island:Mammott&Air Island:Mammott&Earth Island:Mammott&Fire Oasis:Mammott&Fire Haven:Kayna&Fire Oasis:Kayna&,"Like their Common cousins, Rare Tweedles circulate gossip and rumors with much gusto. As they flit from tree to tree, sap, leaves and other debris become wound around their antlers and coalesce. Never ones to miss an opportunity, they then harvest the malleable material and use it for craft-making (macrame is a popular medium). It's still up in the Air whether these artworks actually carry secret messages that only a fellow Rare Tweedle can understand.",2,1,4,cool boy,,0
6,Rare Potbelly,https://mysingingmonsters.fandom.com/wiki/Rare_Potbelly,Plant&Cold&Water&Earth&Shugabush&Gold&Haven&Light&Psychic&,All:Potbelly&Plant Island:Noggin&Water Island:Noggin&Earth Island:Noggin&Fire Haven:Noggin&Plant Island:Mammott&Cold Island:Mammott&Earth Island:Mammott&Light Island:Mammott&Shugabush Island:Mammott&Plant Island:Toe Jammer&Cold Island:Toe Jammer&Water Island:Toe Jammer&Psychic Island:Toe Jammer&Cold Island:Tweedle&Water Island:Tweedle&Earth Island:Tweedle&Fire Haven:Tweedle&Fire Haven:Kayna&Light Island:Kayna&Psychic Island:Kayna&Shugabush Island:Furcorn&Shugabush Island:Oaktopus&Light Island:Fluoress&Psychic Island:Theremind&,"Can you spot the Rare Potbelly?... No seriously, those weights are pretty heavy, and it needs a spotter. This Monster is focused on self-improvement wherever possible, which sets it apart from the garden variety that's more than happy to remain languid and pudgy. Maintaining its six-pack and getting regular braces adjustments are of the utmost priority. Because of its fixation on fitness, the Rare Potbelly is hard-pressed to stay in one place for too long, but if you plant the idea in their multiple heads that it can exercise on your islands as much as it wants, it will stick around.",1,1,9,MB75,,0
7,Rare Noggin,https://mysingingmonsters.fandom.com/wiki/Rare_Noggin,Plant&Air&Water&Earth&Gold&Haven&Faerie&Bone&,Air Island:Tweedle&Water Island:Tweedle&Earth Island:Tweedle&Fire Haven:Tweedle&Plant Island:Potbelly&Water Island:Potbelly&Earth Island:Potbelly&Fire Haven:Potbelly&All:Noggin&Plant Island:Toe Jammer&Air Island:Toe Jammer&Water Island:Toe Jammer&Bone Island:Toe Jammer&Plant Island:Mammott&Air Island:Mammott&Earth Island:Mammott&Faerie Island:Mammott&Fire Haven:Kayna&Faerie Island:Kayna&Bone Island:Kayna&Faerie Island:Floot Fly&Bone Island:Clackula&,"After scouring the Monster World for what felt like forever, the Rare Noggin has been unearthed. Not satisfied with a simple existence as a musical rock, this capricious creature reinvented itself as the building block of an exotic edifice. Because of their limited maneuverability, it's unclear whether a group of Rare Noggins could ever actually cooperate to build anything... perhaps a more down-to-Earth goal would be to just keep the rhythm for its fellow Monsters.",2,1,4,Coke_Can,,0
8,Rare Toe Jammer,https://mysingingmonsters.fandom.com/wiki/Rare_Toe_Jammer,Plant&Cold&Air&Water&Gold&Oasis&Psychic&Bone&,Cold Island:Tweedle&Air Island:Tweedle&Water Island:Tweedle&Fire Oasis:Tweedle&Plant Island:Potbelly&Cold Island:Potbelly&Water Island:Potbelly&Psychic Island:Potbelly&Plant Island:Noggin&Air Island:Noggin&Water Island:Noggin&Bone Island:Noggin&All:Toe Jammer&Plant Island:Mammott&Cold Island:Mammott&Air Island:Mammott&Fire Oasis:Mammott&Fire Oasis:Kayna&Psychic Island:Kayna&Bone Island:Kayna&Psychic Island:Theremind&Bone Island:Clackula&,"To call the Rare Toe Jammer a marshmallow enthusiast would be a profound understatement. It gobbles them up at every opportunity, but thanks to a curious chemical reaction that takes place inside the Monster, they drift to its outer membrane and protrude at all angles. The Rare Toe Jammer's shifting coloration may be a product of this same internal process, but while some believe that this theory holds Water, others claim it's just a phase.",2,1,4,YelmutLifeForm2007,,0
9,Rare Mammott,https://mysingingmonsters.fandom.com/wiki/Rare_Mammott,Plant&Cold&Air&Earth&Shugabush&Gold&Oasis&Light&Faerie&,All:Mammott&Cold Island:Tweedle&Air Island:Tweedle&Earth Island:Tweedle&Fire Oasis:Tweedle&Plant Island:Potbelly&Cold Island:Potbelly&Earth Island:Potbelly&Light Island:Potbelly&Shugabush Island:Potbelly&Plant Island:Noggin&Air Island:Noggin&Earth Island:Noggin&Faerie Island:Noggin&Plant Island:Toe Jammer&Cold Island:Toe Jammer&Air Island:Toe Jammer&Fire Oasis:Toe Jammer&Fire Oasis:Kayna&Light Island:Kayna&Faerie Island:Kayna&Shugabush Island:Deedge&Shugabush Island:PomPom&Light Island:Fluoress&Faerie Island:Floot Fly&,"Given the Mammott's range across several habitats, one can expect to catch the Common Cold Elemental many times. The Rare Mammott is a Monster of a different color; it is a master of hide-and-seek and uses its stripes to camouflage seamlessly with its surroundings. It's even been known to taunt other Monsters by using its talent to throw its rumbly voice halfway across an island. The most resourceful will learn that the Rare Mammott can be caught when given the Cold shoulder.",2,1,4,Kiba and akamaru,,0
10,Tweedle,https://mysingingmonsters.fandom.com/wiki/Tweedle,Cold&Air&Water&Earth&Colossingum&Gold&Haven&Oasis&Tribal&Composer&,Cold Island:Bowgart&Air Island:Cybop&Water Island:Cybop&Earth Island:Cybop&Fire Haven:Cybop&Fire Oasis:Wynq&All:Reflecting Pool&All:Razzli Tree&All:Harpsitree&,"Tweedles are nothing but Air! These flighty creatures really get around, and see themselves as fashionable and popular. Tweedles love to spread whispers and gossip, keeping the social life on their island very interesting.",2,1,4,The Handler-Helper Community,,0
11,Potbelly,https://mysingingmonsters.fandom.com/wiki/Potbelly,Plant&Cold&Water&Earth&Shugabush&Colossingum&Gold&Haven&Light&Psychic&Tribal&Composer&,Plant Island:T-Rox&Cold Island:Congle&Water Island:Reedling&Earth Island:Reedling&Fire Haven:Reedling&Psychic Island:Phangler&Light Island:Spytrap&Shugabush Island:Shugarock&All:Eerie Remains&All:Wild Bagpipe&All:Bloofi Tree&,"Potbellies are all Plant, and grow like weeds. They are welcome participants in the chorus, so long as they wear their pots and refrain from invading others' space.",1,1,9,The Handler-Helper Community,,0
12,Noggin,https://mysingingmonsters.fandom.com/wiki/Noggin,Plant&Air&Water&Earth&Colossingum&Gold&Haven&Faerie&Bone&Tribal&Composer&,Plant Island:Drumpler&Air Island:Drumpler&Earth Island:Drumpler&Faerie Island:Drumpler&Water Island:Shellbeat&Fire Haven:Kayna&Faerie Island:Kayna&Bone Island:Kayna&All:Travelers' Sign&All:Trumplite&All:Fire Bush&,"Noggins are basically musical rocks. Deeply in tune with the earth, their simple rhythms echo an island's pulse. The sensation of reverberation produced by a Noggin motivates all other Monsters.",2,1,1,The Handler-Helper Community,,0
13,Toe Jammer,https://mysingingmonsters.fandom.com/wiki/Toe_Jammer,Plant&Cold&Air&Water&Colossingum&Gold&Oasis&Psychic&Bone&Tribal&Composer&,Plant Island:Furcorn&Cold Island:Furcorn&Water Island:Pummel&Air Island:Riff&Fire Oasis:Whaddle&Psychic Island:Flowah&Bone Island:Uuduk&All:Directions to Nowhere&All:Wild Bagpipe&All:Hollow Log&,"While Toe Jammers may appear fragile, these rubbery Water elementals are very tough. Toe Jammers sing of liquid wonders: deep sea leviathans, crashing surf, flooded basements, and bubble tea!",2,1,4,The Handler-Helper Community,,0
14,Mammott,https://mysingingmonsters.fandom.com/wiki/Mammott,Plant&Cold&Air&Earth&Shugabush&Colossingum&Gold&Oasis&Light&Faerie&Tribal&Composer&,Air Island:Fwog&Plant Island:Entbrat&Cold Island:Quibble&Air Island:Quibble&Fire Oasis:Quibble&Shugabush Island:Quibble&Earth Island:Quarrister&Light Island:Pluckbill&Faerie Island:Stogg&All:Meldablend&All:Bottomless Pit&All:Stritch Skin&,"Mammotts' luxurious fur ensures that these Cold elementals are never chilly. Tangles, however, are an ongoing issue. Their resonant anthem celebrates blizzards and frosted windows. Mammotts do not shovel snow.",2,1,2,The Handler-Helper Community,,0
15,Epic Dandidoo,https://mysingingmonsters.fandom.com/wiki/Epic_Dandidoo,Cold&Water&Earth&Gold&Haven&,All:Mount Knottshurr&All:Fossil-osaurus&All:Sweetstreamz Tree&All:Squeed Statue&,"Do you do your 'do like Dandidoo? Well, Epic Dandidoo would like to have a word with you! This spectacularly showy subspecies loves to be a little bit extra, teasing its famous puffs to nigh unimaginable heights - even for its Rare cousin! The result is a mane of truly Epic proportions, which the endlessly self-confident Monster is exceptionally proud of. Work it!",1,2,9,ehsweep,,0
16,Epic Cybop,https://mysingingmonsters.fandom.com/wiki/Epic_Cybop,Air&Water&Earth&Gold&Haven&,Air Island:Wubbox&Water Island:Wubbox&Earth Island:Wubbox&Fire Haven:Glowl&All:Digger&All:Smunkit&All:The Thunker&,"Epic Cybops are the lords of laziness, the sovereigns of sloth, and the masters of the uni-... uh, the masters of immobility. This idle Epic is exhausted by the mere thought of powering a propeller, and instead favors ziplining place to place. By simply threading steel wire through the loop of its helmet, it can let its body go limp while gravity does the work.",2,2,7,Chris (#4),,0
17,Epic Quibble,https://mysingingmonsters.fandom.com/wiki/Epic_Quibble,Cold&Air&Water&Shugabush&Gold&Oasis&,Cold Island:Bowgart&Air Island:T-Rox&Water Island:Reedling&Fire Oasis:Woolabee&Shugabush Island:Shugajo&All:Bloofi Tree&All:Striking Bulbs&All:Givutawai Tree&,"...(This? THIS is Epic Quibble? You're sure? Okay...)AHEM! The Epic Quibble is a mystifying creature that... that... UGH! We give up. If you want to research this thing, be our guest.",3,2,7,ehsweep,,0
18,Epic Pango,https://mysingingmonsters.fandom.com/wiki/Epic_Pango,Cold&Air&Earth&Gold&Oasis&,Cold Island:Wubbox&Air Island:Wubbox&Earth Island:Wubbox&Fire Oasis:Boskus&All:PU System&All:Castanevine&All:Swurlee Tree&,"When a Rare Pango completes a particularly well-crafted, ice-sculpted self portrait, it feels a fleeting flash of self-confidence that flows into the very soul of its sculpture. These positive vibes animate the icy figure, giving life to an Epic Pango! Epic Pangos are exceptionally warm-hearted in spite of their chilling appearance, projecting their sweet disposition to the world through a Swurlee Nut-flavored ice cream belly badge.",2,2,7,magnit75,,0
19,Epic Shrubb,https://mysingingmonsters.fandom.com/wiki/Epic_Shrubb,Plant&Water&Earth&Gold&Haven&,All:Ti&All:PU System&All:Flappy Flag&All:Bottomless Pit&,"Who conjures illusions and casts enchantments? Who can summon the bellow of a Boss from the wee gullet of a Dipster? The wickedly whimsical, magically mystical Epic Shrubb! These Monsters are imbued with a substantial spellcasting capacity ideal for bewitching unwitting beings. The Epic Shrubb must wear wooly socks to prevent its power from leaking through its spindly feet in its sleep. If only it could lie on its back!",2,2,9,ehsweep,,0
20,Rare Dandidoo,https://mysingingmonsters.fandom.com/wiki/Rare_Dandidoo,Cold&Water&Earth&Gold&Haven&,All:Dandidoo&All:Fire Bush&All:Ambered Thing&All:Piney Tree&,"Unlike the two minds of its distant Quibble relative, the Rare Dandidoo is only governed by a single intelligence, albeit split between two heads. If one peers closely enough, ideas and thoughts can actually be witnessed hopping between the Monster's cerulean Dandiflorets. Rare Dandidoos are said to have the most boundless imaginations in all Monsterdom... although they're particularly fixated on the idea of Ghazts in hats, for some reason.",1,2,9,mblase,,0
21,Rare Cybop,https://mysingingmonsters.fandom.com/wiki/Rare_Cybop,Air&Water&Earth&Gold&Haven&,All:Cybop&All:Babayag Tower&All:Meldablend&All:Flappy Flag&,"Common Cybops might idolize the Ethereal Jellbilly, but the Rare Cybop is no such admirer! It stalwartly marches (or hovers) to the beat of a different drum, transfiguring its mechanical body to match ancient cave drawings of early Cybops. Non-conformity comes with a price, though: the jostling of its twin engines sometimes results in motion sickness, hence its greenish complexion.",2,2,7,Wubboxonator #1,,0
22,Rare Quibble,https://mysingingmonsters.fandom.com/wiki/Rare_Quibble,Cold&Air&Water&Shugabush&Gold&Oasis&,All:Quibble&All:Travelers' Sign&All:Floofy Nest&All:Bottomless Pit&,"Some Quibbles flat out refuse to grow up – in fact, it's one of the few things the two heads can agree upon. Rare Quibbles, who naturally retain the short, stout beaks of their youth, really commit: they preen their crests into radical feather-dos and never replace the colorful keyboards they played as hatchlings. They do need to use beak extenders to reach the rocks... but whatever, man. Still totally hardcore.",3,2,7,Begemot,,0
23,Rare Pango,https://mysingingmonsters.fandom.com/wiki/Rare_Pango,Cold&Air&Earth&Gold&Oasis&,All:Pango&All:Tree Forte Tower&All:Crumpler Tree&All:Saggle Tree&,"While still flightless and prone to cold, the Rare Pango is, at the very least, a bit more resourceful than its Common cousin. Using its elongated talons, it carves and shapes blocks of ice to create igloos to take refuge in during snowstorms. Its ornate crest and patterned plumage are eye-catching, but they do little to improve the low self-esteem shared by all Pangos.",2,2,7,Singing :),,0
24,Rare Shrubb,https://mysingingmonsters.fandom.com/wiki/Rare_Shrubb,Plant&Water&Earth&Gold&Haven&,All:Shrubb&All:Fuzzle Tree&All:Leafy Sea Dragon&All:Puffle Tree&,"The blue back-turf of this creature is specially-adapted to absorb energy in both sunny and low-light environments. Rare Shrubbs devote their bountiful stamina not only to their ceaseless saliva-spraying, but also to the growth of gnarly vine-dreads that drape over their faces and heads.",2,2,9,Ian8599,,0
25,Dandidoo,https://mysingingmonsters.fandom.com/wiki/Dandidoo,Cold&Water&Earth&Colossingum&Gold&Haven&Tribal&Composer&,Cold Island:Spunge&Water Island:Spunge&Earth Island:PomPom&Fire Haven:Glowl&All:Yum Yum Tree&All:Hollow Log&All:Spurrit Statue&,"With downy puffs shimmering in the slightest breath of wind, a Dandidoo sashays elegantly across the landscape. It is much less inclined to strut after it has gone to seed and the puffs have blown away.",1,2,9,The Handler-Helper Community,,0
26,Cybop,https://mysingingmonsters.fandom.com/wiki/Cybop,Air&Water&Earth&Colossingum&Gold&Haven&Tribal&Composer&,All:Tweedle&All:Cozee Cabin&All:Toob&All:Razzli Tree&,"Much more than mere gizmos, Cybops are deep thinkers, and vibrantly alive. Occasionally, Cybops need reminders that attempting to scavenge the body parts of other Monsters for personal repair is not socially acceptable.",2,2,7,The Handler-Helper Community,,0
27,Quibble,https://mysingingmonsters.fandom.com/wiki/Quibble,Cold&Air&Water&Shugabush&Colossingum&Gold&Oasis&Tribal&Composer&,Cold Island:Mammott&Air Island:Mammott&Fire Oasis:Mammott&Shugabush Island:Mammott&Air Island:Scups&Water Island:Scups&All:Fossil-osaurus&All:Trumplite&All:Castanevine&,"Soaring high above, Quibbles are able to spot and collect resonant rocks with which to build their clever keyboards. This happens only occasionally of course, when the two Quibble minds are able to agree on a single purpose.",3,2,7,The Handler-Helper Community,,0
28,Pango,https://mysingingmonsters.fandom.com/wiki/Pango,Cold&Air&Earth&Colossingum&Gold&Oasis&Tribal&Composer&,Cold Island:Maw&Air Island:Maw&Fire Oasis:Maw&Earth Island:Clamble&All:Digger&All:Hollow Log&All:Babayag Tower&,"One would not expect a Monster born of Air and Cold to be flightless and perpetually chilly, however, this is the Pango's reality. The Pango must content itself with remaining on the ground and chattering, playing its part in the endless chorus.",2,2,7,The Handler-Helper Community,,0
29,Shrubb,https://mysingingmonsters.fandom.com/wiki/Shrubb,Plant&Water&Earth&Colossingum&Gold&Haven&Tribal&Composer&,Plant Island:Bowgart&Water Island:Reedling&Earth Island:Reedling&Fire Haven:Reedling&All:Fire Bush&All:Saggle Tree&All:Razzli Tree&,"The willowy Shrubb performs continually in a graceful ballet. This statuesque Monster has astounding stamina, ensuring a steady source of modulation and sprayed saliva for the entire island chorus.",2,2,9,The Handler-Helper Community,,0
30,Epic Oaktopus,https://mysingingmonsters.fandom.com/wiki/Epic_Oaktopus,Plant&Cold&Water&Shugabush&Gold&Psychic&,Plant Island:Re&Cold Island:Re&Water Island:Re&Shugabush Island:Deedge&Psychic Island:Gloptic&All:Hammock&All:Beeyoot Tree&All:Sweetstreamz Tree&,"The unsightly Epic Oaktopus has been infected with a parasitic pathogen known as the RitRawt. This foul fronded fungus burrows into the trunks of unsuspecting Oaktopi and slowly gains control of their mind and body, causing unusual growths and a smell like moldy fruit. Monsters infected by the RitRawt are known to exhibit an increased need to boogie down.",2,2,9,ehsweep,,0
31,Epic Furcorn,https://mysingingmonsters.fandom.com/wiki/Epic_Furcorn,Plant&Cold&Earth&Shugabush&Gold&Light&,Plant Island:Fa&Cold Island:Fa&Earth Island:Fa&Light Island:TooToo&Shugabush Island:Shugitar&All:Hammock&All:Givutawai Tree&All:Freed Thing&,"Not to be mistaken for a Common donning its cold-weather coat, the Epic Furcorn is another breed entirely. A subspecies that has thoroughly embraced its Cold Element half, the Epic Furcorn forgoes flattening its pelt for warmth in favor of exposing itself to the icy chill. Its subzero body temperatures have had visible effects on this fuzzball's physique, fading it blue from tuft to toenail.",1,2,9,Debbie Farley Dunn,,0
32,Epic Fwog,https://mysingingmonsters.fandom.com/wiki/Epic_Fwog,Plant&Air&Water&Gold&Bone&,All:Mi&All:Mount Knottshurr&All:PU System&All:Swurlee Tree&,"Some Monsters love to be held, others just long to hold. Epic Fwog enjoys both! A diehard romantic just like its Common and Rare cousins, the Epic Fwog hopes to impress potential mates with the strength of its snuggles. It can also deliver a mean high-four!",2,2,7,DianeDelsig,,0
33,Epic Drumpler,https://mysingingmonsters.fandom.com/wiki/Epic_Drumpler,Plant&Air&Earth&Gold&Faerie&,All:Fa&All:Elmenco Stump&All:Directions to Nowhere&All:Fossil-osaurus&,"It's not just a Spooktacle story keeping little Monsters up at night: Epic Drumpler is fang-tastically real! Drumplers incubated beneath the haunting glow of a full moon undergo a fur-ocious change: the chosen Monsters sprout coarse fur, all-hearing ears, and a superb sniffer! This canine Epic's feral instincts make it particularly partial to gnawing on the fiberglass bones of the Fossil-osaurus.",2,2,7,ehsweep,,0
34,Epic Maw,https://mysingingmonsters.fandom.com/wiki/Epic_Maw,Plant&Cold&Air&Gold&Oasis&,All:Do&All:Striking Bulbs&All:Tub Fountain&All:The Thunker&,"Maws are sensory creatures that always have an ear to the ground (so to speak), from the pronounced tastebuds and sensitive fur of Common Maw, to the keen eyesight of its Rare cousin. Similarly, Epic Maw is gifted with another valuable sense: smell! With every Epic nose comes the constant threat of sinus infections, but also the savory scent of freshly baked Treats.",2,2,7,gemoliz,,0
35,Rare Oaktopus,https://mysingingmonsters.fandom.com/wiki/Rare_Oaktopus,Plant&Cold&Water&Shugabush&Gold&Psychic&,All:Oaktopus&All:Cozee Cabin&All:Tree Forte Tower&All:Dragoon Statue&,"Much can be said for the Common Oaktopus' powerful tentacles, but when it comes to fine motor skills, that's where the Rares have the upper hand... literally! A pair of nimble tentilla is used to explore the world around them and groom their blond silks. Rare Oaktopi are perhaps a little too wily for their own good, and experiment with various slimes and oozes to brew potent potions.",2,2,9,shugabush bomm,,0
36,Rare Furcorn,https://mysingingmonsters.fandom.com/wiki/Rare_Furcorn,Plant&Cold&Earth&Shugabush&Gold&Light&,All:Furcorn&All:Floofy Nest&All:Harpsitree&All:Yum Yum Tree&,"The rare fuchsia color phase of the Furcorn is truly a sight to behold. Like the more common green Plant-Cold hybrid, its silky pelt is cold to the touch, but not unpleasantly so - sort of like the cold side of a pillow! Unique to the Rare Furcorn, however, is the exotic flower that tips its headstalk - its shape evokes a lovely little bow.",1,2,9,vladlent0722,,0
37,Rare Fwog,https://mysingingmonsters.fandom.com/wiki/Rare_Fwog,Plant&Air&Water&Gold&Bone&,All:Fwog&All:Squeed Statue&All:Ambered Thing&All:Zuffle Tree&,"Rotten luck for a Fwog if a Rare specimen surfaces in its territory. Whereas the Common Fwog aspires to attract a mate by song alone, the Rare invariably gets all the attention, with its spiraling horns and resplendently-colored head growths. The absence of the middle eye proves to be quite the hindrance, however; it must compensate with a heightened sense of smell (hence its nose), and of touch (via its hollow, prehensile toes).",2,2,7,kudesnica_88,,0
38,Rare Drumpler,https://mysingingmonsters.fandom.com/wiki/Rare_Drumpler,Plant&Air&Earth&Gold&Faerie&,All:Drumpler&All:Puffle Tree&All:Floofy Nest&All:Bloofi Tree&,"Endowed with a tall, sloping forehead, it would have been easy for the Rare Drumpler to feel insecure about its hairline, especially when compared to the full-bodied mane of the Common Monster. Unfazed, this positive percussionist instead decided to make the most of the situation and grew two extra sets of eyes! Its appetite is notorious, since its eyes are now truly bigger than its stomach.",2,2,7,AJ light um up,,0
39,Rare Maw,https://mysingingmonsters.fandom.com/wiki/Rare_Maw,Plant&Cold&Air&Gold&Oasis&,All:Maw&All:Beeyoot Tree&All:Zuffle Tree&All:Guitree&,"When comparing the Rare Maw to its pink Common cousin, it's tempting to classify this maroon ball of fur as... well, not a Maw at all. Sprouting spindly horns, a matted goatee and, of course, beady little eyes, this ain't your mama's Maw. It fancies itself a master hunter, tickling its quarry into submission with its horns. No one has plucked up the courage to tell the Rare Maw that Cupcakes can't run away anyhow. Please don't spoil its fun.",2,2,7,grammie,,0
